{
  "$schema": "https://agentrig.ai/schema/plugin-history.json",
  "active_version": {
    "installability": "installable",
    "lock": "plugins/agentrig/core-committer/versions/0.1.0/AGENTRIG_LOCK.json",
    "manifest": "plugins/agentrig/core-committer/versions/0.1.0/.plugin/plugin.json",
    "path": "plugins/agentrig/core-committer/versions/0.1.0/",
    "published_at": "2026-04-16T10:00:00Z",
    "review": "plugins/agentrig/core-committer/versions/0.1.0/AGENTRIG_REVIEW.json",
    "snapshot_digest": "sha256:ee2c5a69f9d556178149b38c91f9960003bdbf480ececa201fd150771af87b18",
    "source": "plugins/agentrig/core-committer/versions/0.1.0/AGENTRIG_SOURCE.json",
    "trust_tier": "official",
    "version": "0.1.0"
  },
  "description": "Adds a committer skill with a safe commit helper script.",
  "installability": "installable",
  "keywords": [
    "git",
    "workflow",
    "core"
  ],
  "latest_version": "0.1.0",
  "name": "Committer skill",
  "namespace": "agentrig",
  "plugin": "agentrig.core-committer",
  "trust_tier": "official",
  "versions": [
    {
      "installability": "installable",
      "lock": "plugins/agentrig/core-committer/versions/0.1.0/AGENTRIG_LOCK.json",
      "manifest": "plugins/agentrig/core-committer/versions/0.1.0/.plugin/plugin.json",
      "path": "plugins/agentrig/core-committer/versions/0.1.0/",
      "published_at": "2026-04-16T10:00:00Z",
      "review": "plugins/agentrig/core-committer/versions/0.1.0/AGENTRIG_REVIEW.json",
      "snapshot_digest": "sha256:ee2c5a69f9d556178149b38c91f9960003bdbf480ececa201fd150771af87b18",
      "source": "plugins/agentrig/core-committer/versions/0.1.0/AGENTRIG_SOURCE.json",
      "trust_tier": "official",
      "version": "0.1.0"
    }
  ]
}
